{
  "schemaVersion": "1.1.0",
  "contractKind": "blueprint",
  "blueprintId": "overlay-modal",
  "surfaceRole": "independent",
  "description": "Auxiliary modal or overlay pattern for loading, error, confirm, and room detail support surfaces.",
  "blocks": [
    {
      "blockId": "overlay-root",
      "role": "overlay",
      "sourceName": "OverlayRoot",
      "unityTargetPath": "OverlayRoot",
      "layout": {
        "axis": "overlay",
        "padding": 16,
        "gap": 16,
        "minHeight": 0,
        "minWidth": 0,
        "alignment": "stretch",
        "sticky": true,
        "scroll": false
      },
      "children": [
        "overlay-card",
        "primary-cta"
      ]
    },
    {
      "blockId": "overlay-card",
      "role": "content",
      "sourceName": "OverlayCard",
      "unityTargetPath": "OverlayCard",
      "layout": {
        "axis": "vertical",
        "padding": 16,
        "gap": 12,
        "minHeight": 0,
        "minWidth": 0,
        "alignment": "stretch",
        "sticky": false,
        "scroll": false
      },
      "children": []
    },
    {
      "blockId": "primary-cta",
      "role": "cta",
      "sourceName": "PrimaryAction",
      "unityTargetPath": "OverlayCard/PrimaryAction",
      "layout": {
        "axis": "horizontal",
        "padding": 0,
        "gap": 8,
        "minHeight": 0,
        "minWidth": 0,
        "alignment": "stretch",
        "sticky": false,
        "scroll": false
      },
      "children": []
    }
  ],
  "defaults": {
    "states": {
      "default": true,
      "loading": true,
      "error": true,
      "disabled": true
    },
    "validation": {
      "frame": "390x844",
      "firstReadOrder": [
        "overlay-card",
        "primary-cta"
      ],
      "requiredChecks": [
        "contract",
        "overlay separated from main flow"
      ],
      "smokeScripts": []
    }
  },
  "notes": [
    "Use this for room detail, loading overlay, confirm dialog, and common error modal families."
  ]
}
